filename,Number of vehicles in accident,Accident Type,Person Injury?,Need for ambulance?,Need for firetruck?,Need for Police?,Types of vehicles involved,Fire?,Weather,Low Res/Bad Footage?
000000.mp4, 2, Angle/Side Impact, Yes, Yes, No, Yes," Motorcycle, Motorcycle", No," Day, clear", Yes
000001.mp4, 3, Appears to be a chain reaction rear-end collision.," Possibly.  It is not directly visible if there are injuries, but the severity of the crash suggests the possibility."," Possibly. Given the nature of the accident, the need for an ambulance cannot be ruled out."," Possibly. Although no fire is visible, firetrucks are often dispatched to accident scenes."," Yes. Given the number of vehicles and the potential for injuries, police are likely required for traffic management and accident investigation.", Sedans and SUVs., No.," Day, snowy conditions.", Yes.
000002.mp4, 4, T-bone," Yes (likely, due to the severity of the crash)", Yes, Yes (due to fire), Yes," SUVs (2), Trucks (2), Sedan (1)", Yes," Day, clear", Yes
000003.mp4,2,T-bone,"Potentially yes (difficult to confirm visually, but the impact seems significant)",Likely yes,Probably no,Yes,Sedan and a box truck or van (partially obscured).,No,"Day, clear weather.",No
000004.mp4, 2 (based on the visual evidence of the cars colliding), T-bone (appears to be a perpendicular impact based on the relative positions of the vehicles)," Unknown, cannot be determined from the video."," Unknown, cannot be determined from the video."," Unknown, cannot be determined from the video."," Likely, due to the traffic accident, it is standard procedure."," Looks like at least one sedan and potentially another sedan or SUV, but more clarity needed."," No, there is no visible fire."," Night, weather unknown but appears clear."," Yes, the footage is low resolution and somewhat blurry."
000005.mp4, 2, T-bone or Broadside Collision (based on vehicle trajectories), Possibly yes (based on the severity of the impact seen), Likely yes (due to the potential for injuries)," Possibly no (no visual indication of fire, but could be needed for scene safety or extrication)", Yes (to investigate and file a report), SUV or truck. SUV or sedan, No," Night, unclear weather (possibly dry based on the road appearance)", Yes
000006.mp4, 2, T-bone (likely), Undetermined (Based on visual analysis only), Undetermined (Based on visual analysis only), No, Yes (likely due to the nature of the accident)," Difficult to determine definitively due to the video quality, but one appears to be a motorcycle/scooter and the other could be a sedan or another type of car.", No," Night, clear (likely)", Yes
000007.mp4, 2, T-Bone (based on the visual of one vehicle impacting the side of another), Unknown. (Cannot determine injury from the images alone), Unknown. (Cannot determine medical needs from the images), No (No visible fire or indication of fire hazard)," Unknown, but likely yes (Due to the severity of a T-bone collision, police presence is usually required for investigation and reporting)"," Sedan, Sedan", No," Night, Unknown weather (appears clear, but not definitive)"," Yes (The image quality is low, making it difficult to identify details)"
000008.mp4, 0, N/A, No, No, No, No, 1 Sedan, No," Night, unclear weather (appears dark)", Yes
000009.mp4, Insufficient information to determine, Insufficient information to determine, Insufficient information to determine, Insufficient information to determine, Insufficient information to determine, Insufficient information to determine," SUV, Truck", No," Night, Weather Unknown", Yes
000010.mp4, 3, Chain reaction rear end," Likely yes, given the severity of impact and multiple vehicles involved."," Likely yes, due to potential injuries from the collision."," Possibly, depending on the extent of damage and any potential hazards."," Yes, to investigate the accident, manage traffic, and file a report.", Primarily SUVs and sedans.," No, there is no visible sign of fire."," Day, weather appears clear and bright."," Yes, the footage is low resolution and grainy."
000011.mp4, 2, T-bone (potentially), Cannot determine from image., Cannot determine from image., No," Possibly, given the nature of the accident.", Appears to be two vehicles. One vehicle looks like a taxi and one looks like a sedan., No," Daytime, weather appears clear.", Yes
000012.mp4, 1," Unknown, appears to be a single vehicle spinning out of control, but without further context it is impossible to know if an actual accident occurred.", Unknown, Possibly, No, Possibly, Sedan, No," Night, weather is unclear, potentially wet or foggy.", Yes
000013.mp4, 2, T-bone, Potentially yes (due to the nature of a T-bone collision)., Potentially yes (standard procedure with T-bone).," Unlikely (unless there's a fire or vehicle entrapment, which is not visible).", Yes (accident investigation)., SUV and Sedan, No," Night, clear.", Yes
000014.mp4, 2, T-Bone," Potentially yes (due to the nature of a T-bone collision, injury is possible).", Probably yes (given the potential for injury in a T-bone collision).," Probably no (no visible fire or indication of entrapment, but difficult to assess with certainty).", Yes (accidents involving potential injuries and property damage typically require police investigation)., Sedans appear to be involved in the accident., No.," Day, weather appears to be wet.", Yes.
000015.mp4, 0 (There's no visible accident in the provided frames)., N/A, no, no, no, no (But Dubai Police branding is present at top of view)," Sedan, Truck, Van, SUV", no," Night, appears to be wet conditions.", yes
000016.mp4, It is not possible to determine if an accident occured., Cannot determine from images., Cannot determine from images., Cannot determine from images., Cannot determine from images., Cannot determine from images.," Bus, white sedan and black SUV", No.," Day, weather appears clear.", Yes.
000017.mp4," 0 (Based on the provided frames, there is no visible accident.)", None, No (Based on the lack of accident.), No, No, No," SUVs, sedans, a motorcycle, and vans.", No," Day, clear weather.", No (The footage appears to be reasonably clear.)
000018.mp4, Unable to Determine, Unable to Determine, Unable to Determine, Unable to Determine, Unable to Determine, Unable to Determine, Able to see multiple vehicles. Unable to Determine type., no," Night, weather appears clear", yes
000019.mp4, 2, T-bone (based on vehicle positions in the frames), Cannot be determined from the footage., Cannot be determined from the footage., Cannot be determined from the footage.," Cannot be determined from the footage, but likely."," SUV, Sedan", No," Night, wet conditions", Yes
000020.mp4, 0, None, no, no, no, no," SUV, sedan, taxi", no," Day, clear", no
000021.mp4, 0, None apparent in the image.," Unknown, no indication in the image."," Unknown, no indication in the image.", No.," Unknown, no indication in the image."," One vehicle is visible, appears to be a sedan.", No.," Night, and the roads appear wet, likely due to rain.", Yes. The image is low resolution and grainy.
000022.mp4,2,T-bone,Potentially yes (based on the severity of the impact).,Potentially yes (based on the severity of the impact).,No,Yes,Sedan and Sedan/Hatchback (Difficult to tell exact model),No,"Day, clear",Yes
000023.mp4, 2, T-bone,  Cannot determine from image.,  Cannot determine from image., No,"  Likely, based on location and type of accident.","  SUV, Truck", No," Night, clear", No
000024.mp4, 0 (There is no visible accident occurring in the provided frames), None, Unknown (no accident is occurring), No, No, No," Sedan, SUV, Bus, Van", No," Day, clear", Yes
000025.mp4, 2, T-bone, Unknown, Unknown, No, Likely, Sedan and SUV, No," Day, clear", Yes
000026.mp4,1,Trailer detachment causing it to roll over,"Appears likely, but difficult to confirm.",Maybe.,No.,Yes.,Van and trailer.,No.,"Day, clear.",Yes.
000027.mp4, 2, Could not be determined from this picture., Unknown., Unknown., Possibly. There is a firetruck on the screen., Possibly. There is what appears to be a police car on the screen.," Based on the image, it appears to be a sedan and what appears to be a truck.", No.," Day, Rainy.", Yes.
000028.mp4, 2, T-bone, Possibly (unable to confirm from footage), Possibly (unable to confirm from footage), No, Yes (due to accident)," Sedan, Truck", No," Day, Clear", No
000029.mp4,2,T-Bone,Likely yes,Likely yes,No,Yes,Truck and sedan,No,"Day, clear",Yes
000030.mp4, 2, Rear end, Unknown, Unknown, Unknown, Likely," Truck, Sedan", No," Night, likely wet/raining based on road surface.", Yes
000031.mp4, 2, T-Bone," Cannot determine with certainty, but likely yes.", Likely yes., Unlikely., Likely yes.," Truck, Sedan (dark color)", No.," Day, clear.", Yes.
000032.mp4, 2, T-bone, Cannot determine., Cannot determine., Cannot determine., Cannot determine.," Sedan, Possibly a van", No," Day, clear", Yes
000033.mp4,2,T-bone,Likely Yes (given the nature of the collision),Likely Yes,Possibly No,Likely Yes,Truck and Sedan,No (based on visible evidence),"Day, Clear",Yes
000034.mp4, 0 (I cannot see any evidence of a collision in the frames provided), None (Based on visual evidence), No (Based on visual evidence), No (Based on visual evidence), No (Based on visual evidence), No (Based on visual evidence)," SUV (One is visible in the foreground with its brake lights on, others are partially visible)", No (Based on visual evidence)," Night, Rainy (Surface appears wet and lights reflect on the road)", Yes (The image is blurry and lacks detail)
000035.mp4, 2, T-bone, Unknown, Unknown, No, Likely, Sedan and Truck, No," Day, Snowy/Sleet", Yes
000036.mp4, 2, T-bone," Yes, likely."," Yes, likely.", No, Yes, Truck and Car., No," Day, clear", Yes
000037.mp4, 1, Rollover, Likely yes (due to the severity of the rollover), Yes (rollover accidents often require medical attention), Possibly (depending on potential for fire or need for extrication), Yes (accidents involving significant damage and potential injury typically require police investigation), SUV or Van, No (no visible flames or smoke)," Day, likely clear (based on lighting and visibility)"," Yes (image quality is poor, making detailed analysis difficult)"
000038.mp4, 5, Chain reaction/Pile-up (likely initiated by the bus hitting the car in front of it), Possibly yes (it is difficult to confirm in this video), Possibly yes (given the number of vehicles and type of accident), No (no indication of fire), Yes (given the number of vehicles and accident severity),"  Bus, multiple Sedans, multiple Vans.", No," Day, likely clear", Yes
000039.mp4, 2, T-bone," Likely yes, based on the severity of the impact.", Likely yes.," Possibly, depending on potential hazards from the damage, but not definitively visible in the images."," Yes, to investigate the accident.", Appears to be a van/small transport vehicle and a box truck.," No, not visibly."," Daytime, wet/rainy conditions."," Yes, the footage quality is low."
000040.mp4, 1 (only one vehicle is visible crashing), Single vehicle crash, Unknown (cannot be determined from the footage), Unknown (cannot be determined from the footage), Unknown (cannot be determined from the footage), Likely (due to the severity of the crash), Truck or SUV, No," Day, clear", Yes
000041.mp4, 1," Single vehicle accident, potentially a loss of control leading to a crash."," Based on the video alone, it's impossible to definitively say.  Potentially yes due to crash.", Potentially yes due to crash.,  Potentially yes due to crash.," Yes, likely needed to investigate the cause and manage the scene.", Sedan.," No, not visibly."," Night, appears to be wet/rainy."," Yes, the resolution is low, and the footage is somewhat shaky."
000042.mp4, 2, T-bone, Likely yes (based on the severity of the impact)., Likely yes (due to the potential for injuries)., Possibly (depending on potential fluid leaks or fire risk)., Yes (to investigate the accident and manage traffic).,"  Sedan, Sedan", No (no visible signs of fire).," Day, clear", Yes
000043.mp4, 2, Rear end, Unknown, Unknown, No, Likely, Bus and sedan, No," Day, clear", Yes
000044.mp4, 2, Angle or side-impact collision with potential rollover," Likely yes, based on the severity of the impact.", Yes, No, Yes, Truck and Motorcycle, No," Day, clear", No
000045.mp4, 1, Struck Motorcycle., yes, yes, no, yes, motorcycle., no," Day, Clear", yes
000046.mp4, 2, T-bone, yes. The person fell off the bike., Likely yes., No., Likely yes., Sedan and motorcycle., No.," Day, clear.", Yes.
000047.mp4,2,T-Bone,Likely yes (due to the severity of the impact),Likely yes,Possibly yes (due to smoke/potential hazards),Yes (accident investigation),SUV and sedan.,"No (smoke is present, but not necessarily fire)","Day, clear",No
000048.mp4, 2, T-Bone, I am unable to determine., I am unable to determine., I am unable to determine., Yes," Sedan, Truck", No," Day, Clear", Yes
000049.mp4, 1, Pedestrian Hit," Yes (Likely, given the pedestrian is on the ground)"," Yes (Likely, given the pedestrian is on the ground)", No, Yes (Due to injury and accident investigation)," SUV, Pedestrian", No, Day/Clear, Yes
000050.mp4, 2, T-bone.,  Likely yes., Likely yes., No., Yes., SUV and Sedan, No.," Day, overcast/slightly hazy.", Yes.
000051.mp4, 2, T-bone, Yes (people are shown on the ground after the collision)," Likely yes, based on the apparent injuries."," Unlikely, no fire visible."," Likely yes, to investigate the accident.", Sedan and scooter., No," Day, clear", Yes
000052.mp4, 2, T-Bone, yes, yes, no, yes," sedan, sedan", no," Day, clear", yes
000053.mp4, 2, T-bone," Possibly, difficult to determine from the footage."," Possibly, based on the severity of the collision."," Unlikely, no fire is visible."," Yes, due to the traffic collision and potential injuries.", Dump Truck and Cement Truck/Mixer., No," Day, rainy.", Yes
000054.mp4, 2, T-bone, Possibly. The footage is too unclear to determine definitively.," Possibly. Due to the T-bone nature, it is possible.", Uncertain. A firetruck is already on the scene but unclear if related., Probably. Police are usually called for accidents of this type., Sedan and possible a van/small truck., No," Day, rainy.", Yes
000055.mp4,2,T-bone,Potentially yes (based on the nature of a T-bone collision),Potentially yes (given potential injuries),No (no visible signs of fire or entrapment),"Yes (standard for traffic accidents, especially with potential injuries)","At least one sedan, but the types of the other vehicles are not clear",No,"Day, clear",Yes
000056.mp4, 2, Intersection Collision (possibly involving a turning vehicle failing to yield or running a red light)," Yes (Based on the imagery, someone is on the ground after the collision)"," Yes (Likely, given the apparent injury to a pedestrian)", No (No indication of fire or need for extraction)," Yes (Standard for traffic accidents, especially with injuries)", Van/Minivan and Motorcycle/Scooter, No," Day, Clear"," Yes, the resolution is low and the video quality is not great."
000057.mp4, 2, T-Bone. The car from the right side collides in middle of the car already in the intersection., I cannot determine if there are any injuries., I cannot make this determination., I cannot make this determination.," Due to the nature of the accident, the police are most likely necessary.", It appears two sedans were involved in the accident., No," Night, wet roads.", Yes. The video has low resolution and quality.
000058.mp4, 2," T-bone (likely, based on vehicle trajectories)"," Yes (potential, given the accident type)"," Yes (potential, due to possible injuries)", No (no visible fire or smoke)," Yes (likely, to investigate the accident)"," Sedan, Unknown (motorcycle or scooter, potentially)", No," Night, likely clear", Yes
000059.mp4,  Potentially 2 (but impact not directly visible)., Cannot be determined with certainty. It appears one vehicle might have struck pedestrians at an intersection.,"  Potentially yes (based on the presence of pedestrians in the crosswalk, it looks like one of them may have been hit and is on the ground).", Likely yes (due to potential pedestrian injury).,"  No (based on the frames, there's no indication of fire or hazardous material).", Yes (likely required to investigate the accident and determine fault)., One sedan., No.," Night, weather appears clear."," Yes (the video is low resolution and somewhat blurry, making precise details difficult to ascertain)."
000060.mp4,2,T-bone,Likely yes (based on people gathering around the vehicles),Likely yes (due to the potential for injury),Likely no (no visible fire or indication of hazardous materials),Yes (given the severity of the collision and potential injuries),"Sedan, Sedan",No,"Night, weather unknown but streets are wet.",Yes
000061.mp4, 2, T-bone," Unknown, likely based on the force of impact.", Likely," Unknown, but possible if there is fire or significant vehicle damage requiring extrication."," Yes, to investigate the accident and determine fault.", Appears to be two sedans or one sedan and one taxi.," Yes, based on the flash of light"," Night, possibly rainy or wet based on the road surface."," Yes, the footage is low resolution."
000062.mp4,2,T-bone,Possibly (Unable to definitively determine from the image),"Possibly (Unable to definitively determine from the image, but likely given the severity)","Possibly (Unable to definitively determine from the image, but likely given the severity)",Yes,Sedans,No,"Night, clear",Yes
000063.mp4, 2, T-bone," Potentially yes (due to the severity of the impact, it is likely someone may be injured)"," Potentially yes (given the type of accident, it is likely needed)", Potentially no (There is no immediate indication of fire.), Yes (Police are present with lights flashing)., SUV/minivan and sedan, No," Night, assumed clear.", Yes (footage is low resolution)
000064.mp4, 2, T-bone," Cannot determine with certainty, but likely based on the impact."," Likely, given the severity of the impact."," Possibly, but not indicated by the footage."," Yes, due to the severity of the accident and potential injuries.", Looks like two vans or similar sized vehicles., No.," Night, weather appears clear.", No.
000065.mp4, 2, T-bone, Unknown (unable to determine from the video), Unknown (unable to determine from the video), No, Likely (due to the nature of the collision), Van and sedan, No," Day, snowy/overcast", Yes
000066.mp4, 2, T-Bone," Likely yes, but not certain"," Likely yes, but not certain", No, Yes,  Potentially both sedans., No," Night, snow", Yes
000067.mp4, Cannot determine from the information provided., Cannot determine from the information provided., Cannot determine from the information provided., Cannot determine from the information provided., Cannot determine from the information provided., Cannot determine from the information provided., Sedans, No," Night, likely clear", Yes
000068.mp4, 4, Chain reaction rear-end collision.," Unknown from the video, but possible.","  Likely, but cannot confirm from footage.", No, Yes," SUV, sedan, box truck, dump truck", No, Day/Clear, No
000069.mp4, 2, Train vs Truck," Likely yes, given the severity of the impact."," Yes, highly likely due to the potential for serious injuries."," Possibly, depending on the extent of damage and the presence of any hazards (e.g., fuel spill)."," Yes, to investigate the accident, manage traffic, and file a report.", Train and Truck," Not visible in the frames, but possible."," Day, clear."," Yes, the footage is low resolution and grainy."
000070.mp4, 2, Side impact/angle impact (based on the vehicles appearing to collide at an angle).," Cannot determine with certainty from the images, but I would assume there is injury.","  Cannot determine with certainty from the images, but I would assume so.", No (There is no indication of fire or hazardous material spill.)," Yes (Given the collision, police involvement is likely for investigation and reporting.)", SUV and Truck, No," Day, snowy", No
000071.mp4," Unable to determine. The image shows a roundabout with multiple vehicles, but it's unclear if any are involved in an accident.", Unable to determine., Unable to determine., Unable to determine., Unable to determine., Unable to determine.,"  School bus, sedans, motorcycle. Additional cars and vans are too far away to classify.", No.," Day, weather appears clear.", Yes. The resolution is low and the image quality is poor.
000072.mp4," 0 (Based on the image, there is no visible accident)", N/A, No, No, No, No," Cars, Van", No," Day, unclear/possibly wet roads", Yes
000073.mp4, 0 (There does not appear to be an accident in this image.), N/A, no, no, no, no," Bus, van, sedan, and possibly a small hatchback or sedan type vehicle in the distance.", no," Daytime, clear", yes
000074.mp4, 2,  T-Bone (based on the apparent position of the vehicles), Undetermined (cannot be determined from image alone), Undetermined (cannot be determined from image alone), No (no visible fire),  Likely yes (based on the apparent nature of the accident)," Sedan, Motorcycle", No," Night, weather is unclear", Yes
000075.mp4, 2 (It appears there are two vehicles involved in the incident)," T-bone (Based on the position of the vehicles, it looks like a vehicle crashed into the side of another)"," Likely Yes (Given the type of accident and the presence of people near the vehicles, injuries seem plausible)", Likely Yes (Due to the potential for injuries), No (There is no indication of fire or need for rescue), Yes (To investigate and manage the incident)," Car, scooter (One appears to be a car, the other a scooter)", No (There is no visible fire)," Day, clear (It is daytime and the weather appears to be clear)", Yes (The image is low resolution and the video is of poor quality)
000076.mp4,Cannot determine from the available information.,Cannot determine from the available information.,Cannot determine from the available information.,Cannot determine from the available information.,Cannot determine from the available information.,Cannot determine from the available information.,"Auto Rickshaw, motorcycle, sedan",no,"Day, clear",yes
000077.mp4, 0, None, No, No, No, No, None, No," Night, cannot determine weather from the footage.", Yes
000078.mp4, 2, Likely T-bone or angle collision.," Unknown, but possible."," Unknown, but possible.", No., Likely.," Car, Motorcycle/Scooter", No," Night, clear.", Yes.
000079.mp4, 1,  Likely collision of a bus into a line of cars.,"  Potentially yes, due to impact."," Potentially yes, due to the bus vs car incident."," Likely no, based on current information."," Likely yes, due to the bus versus car."," Bus, vans, sedans, motorcycles", No.," Day, weather appears clear"," Yes, low resolution and some obstruction."
000080.mp4,2,Appears to be a broadside/angle collision (T-bone is a possibility but hard to confirm),Yes (based on individuals down on the crosswalk),Yes (due to apparent injuries),No (no visible fire or indication of entrapment),Yes (due to the accident and injuries),Motorcycle/scooter and possibly an auto rickshaw,No,"Day, clear",Yes
000081.mp4,2,T-bone,Yes,Yes,No,Yes,Motorcycle and Car,No,"Day, clear",Yes
000082.mp4, 1 (possibly more involved in a chain reaction)," Unknown. The image does not clearly show an accident in progress. Based on the proximity of vehicles, the accident may be a side scrape.", Unknown. The image quality is insufficient to determine if anyone is injured., Unknown., No.," Possibly. Given the congestion, it is likely authorities would need to arrive to maintain control of the traffic."," Auto Rickshaw. Potentially others, but obscured.", No.," Day, clear.", Yes.
000083.mp4, 2, T-bone (based on the visible positions of the vehicles), Cannot determine from the image., Cannot determine from the image., Cannot determine from the image., Cannot determine from the image., SUV and sedan., No.," Night, weather conditions are not discernible.", Yes.
000084.mp4, 0 (I see no accident), N/A (No accident present), no, no, no, no," N/A (no accident, just a bunch of mixed vehicle types like sedans, SUVs, trucks, busses, motorcycles, and auto rickshaws)", no," Day, clear", yes
000085.mp4, 2," Appears to be an intersection collision, potentially a T-bone or near T-bone type of impact, but the low resolution makes it hard to determine.", Possibly yes. There's a person on the motorcycle on the ground.," Probably yes, given the potential for injury to the motorcycle rider."," Unlikely, based on the visual information provided."," Likely yes, to investigate the accident and determine fault.", A small car (possibly a hatchback or compact) and a motorcycle., No.," Day, appears to be clear.", Yes.
000086.mp4," Potentially 2, although it's difficult to definitively say if they are involved in an accident.", Undetermined. The image quality is too poor to determine the type of collision., Unknown. I cannot determine this from the image., Unknown., Unknown., Unknown., Potentially a truck or heavy vehicle and possibly a car or other vehicle., No.," Night, weather is unclear.", Yes.
000087.mp4, 2, T-bone, Likely yes., Likely yes., No., Yes.," Sedan, Motorcycle", No.," Day, clear.", Yes.
000088.mp4, Impossible to tell from image., Impossible to determine from this video, Unknown., Unknown., Unknown., Unknown.," Sedans, SUVs/Vans, Buses, Motorbikes.", No.," Daytime, likely clear or partly cloudy.", Yes. The footage has low resolution and some blurriness.
000089.mp4," Unable to determine, but I do see tire marks on the pavement, suggesting a car was speeding and driving around this roundabout.", Unknown due to limited visibility., Unable to determine., Unable to determine., Unable to determine.," Possibly, due to the possibility of reckless driving of the vehicle involved."," Sedans, SUVs, Motorcycles, Trucks, and other types of vehicles are visible in the area.", No.," Daytime, clear weather.", Yes.
