000090.mp4, 2, T-bone, Likely yes, Likely yes, No, Likely yes," Van, Motorcycle", No," Day, clear", Yes
000091.mp4, 2, Possible T-bone or angle collision.," Cannot determine with certainty, but potential for injury is possible.", Cannot determine with certainty., No., Likely., Sedan and motorcycle., No.," Daytime, weather appears to be clear.", Yes.
000092.mp4,1 (though technically it impacted a pole),Single vehicle collision with a utility pole.,Unknown (cannot determine from the images),Unknown (cannot determine from the images),Possibly (likely needed for downed power lines and potential hazards).,"Yes (accident investigation, traffic control).",Large truck (possibly a commercial truck),No (no visible flames),"Day, overcast/potentially wet.",No (the footage is clear enough to discern details)
000093.mp4, 2, Appears to be a possible rear-end collision between a vehicle and a motorcycle.," Likely yes, given the nature of the accident"," Likely yes, for assessment and possible treatment."," No, there's no visible fire or indication of the need for a firetruck."," Likely yes, to investigate the accident and file a report."," Motorcycle, truck", No.," Daytime, Wet/Rainy"," Yes, the footage is low resolution."
000094.mp4, 0, No accident is observed., No, No, No, No," SUVs, trucks, vans, sedans.", No," Day, clear.", Yes
000095.mp4, 2, Truck T-Bone," Possibly, undetermined.", Probably.," Possibly, undetermined.", Yes., Semi-truck and sedan., No.," Day, clear.", Yes
000096.mp4,2,Rollover (possibly involving initial contact with another vehicle or barrier),Likely yes (due to the severity of the rollover),Likely yes,"Possibly yes (due to the potential for fire or hazardous material spill, and the need for extrication)","Yes (for traffic control, accident investigation, and reporting)","Likely a box truck or similar commercial vehicle, and potentially a sedan or other vehicle that may have initially been involved.",No (but there is smoke or dust from the crash),"Day, clear",Yes (the resolution is low and the footage is somewhat grainy)
000097.mp4, 2, It appears to be a broadside or t-bone type accident between a scooter and a white van.," Based on the image, it is likely a person was injured. It appears that a pedestrian is on the ground."," Yes, it's likely an ambulance is needed due to the potential for injury."," No, there's no indication of a fire."," Yes, police involvement would be standard for accident investigation and traffic control.", Scooter and a van., No.," Daytime, rainy or wet conditions."," Yes, the footage is low resolution and somewhat blurry, making definitive assessment difficult."
000098.mp4, 0. There is no accident occurring in the frame., N/A, no, no, no, no," There are several vehicles visible: vans, sedans, and at least one motorcycle.", no, Night; Wet or possibly just damp due to reflections.," Yes, the footage is low resolution."
000099.mp4," 0 (Based on the video, there is no visible accident. Only one truck is seen.)", None (No accident is visible.), No (No indication of injury), No (No visible reason), No (No visible reason), No (No visible reason), 1 (Truck), No," Night, weather unclear (due to the darkness and resolution)", Yes
000100.mp4, 0, No accident, No, No, No, No," Sedans, van, bus", No," Day, Rainy", Yes
000101.mp4,2,T-bone,Yes,Yes,No,Yes,Van and Minivan,No,"Day, clear",Yes
000102.mp4, 2, Rear-end, Unknown, Unknown, No, Likely," Sedan, Sedan", No," Day, Wet", Yes
000103.mp4, 2, T-Bone (most likely based on vehicle positioning in frame), Unknown, Unknown, Unknown, Unknown, Sedan and minivan., No," Daytime, clear weather", Yes
000104.mp4," 0 (Based on this single frame, there's no evidence of an accident.)", N/A (No accident is visible)," No (Based on this single frame, there's no evidence of injuries)"," No (Based on this single frame, there's no evidence of a need for an ambulance)"," No (Based on this single frame, there's no evidence of a fire or a need for a firetruck)"," No (Based on this single frame, there's no evidence of a need for police)", One van/taxi is visible., No," Night, wet (likely raining)", Yes
000105.mp4," It's difficult to say for sure based on this single frame, but it *appears* there may be two vehicles involved in a possible incident in the middle of the intersection."," Potentially T-bone, however, the resolution obscures the details."," Difficult to assess from the frame. I would presume yes, given a pedestrian appears to be involved in the crash."," Yes, based on a pedestrian involved."," No, based on visual assessment; unlikely unless there is additional information about the incident."," Yes, based on a potential collision in the intersection.", Based on what can be seen: * Potentially a sedan and a SUV.," No, no signs of fire."," Daytime, and the weather looks *potentially* overcast or rainy based on the muted lighting."," Yes, the footage is low resolution and blurry, making a definitive assessment difficult."
000106.mp4, 2, T-bone, Yes (Based on the motorcycle rider falling off and visible impact)," Yes (Likely, given the apparent injury)", No (No visible signs of fire or other hazards requiring fire department), Yes (Likely needed for accident investigation), Motorcycle and a Red car (looks like a small SUV), No," Day, clear", Yes
000107.mp4, 0 (I see no accident in the images), N/A, No, No, No, No," Cars, van, taxi", No," Day, rainy", Yes (low resolution)
000108.mp4,2,T-bone,Likely yes (given the ambulance present),Yes (ambulance is visible in frame),Unlikely (no fire is visible),Likely yes (standard procedure for accidents),Two sedans,No,"Daytime, rainy or wet conditions",Yes
000109.mp4, 2," Appears to be a side impact, possibly a T-bone collision.", Cannot determine from the image., Cannot determine from the image., Cannot determine from the image., Cannot determine from the image., Bus and sedan., No.," Night, unclear weather (appears possibly wet/damp roads).", Yes.
000110.mp4,2,T-bone,Yes,Yes,No,Yes,"Sedan, sedan",No,"Day, clear",Yes
000111.mp4, 2, T-Bone," Unable to determine due to image quality, but potentially yes.", Possibly yes., Possibly yes., Yes., SUV and Sedan., Yes," Night, wet (rainy/slippery conditions)", Yes
000112.mp4," 0 (Based on the single image, there is no visible accident.)", N/A (Since there is no accident), No (No visible injuries in this single frame), No (No indication of need), No (No indication of fire or need), No (No accident visible in the frame)," Sedan, Truck", No (No fire visible)," Day, Clear (Appears to be daytime with clear weather)", Yes (The image is of low resolution and grainy)
000113.mp4,2 (possibly more partially obstructed),It appears to be a side-impact or near side-impact collision. Potentially vehicles were merging or attempting a left turn in front of oncoming traffic.,Unknown. The footage alone cannot determine if injuries occurred.,Undetermined. The video does not offer enough information.,Unknown. There is no fire visible and impact does not appear severe.,Likely. Accidents involving vehicles on public roads usually require police presence for investigation and documentation.,"Based on appearance, the vehicles may be sedans and taxis.",No.,Night; wet conditions (likely raining or recently rained).,"Yes, it is low resolution and does not provide clear details."
000114.mp4, 2 (Two), T-Bone (Based on the vehicles' orientation and likely point of impact)," Likely Yes (Based on the type of accident, but it's impossible to say for sure from the video.)", Likely Yes (Due to the potential for injuries in a T-Bone collision.)," Unlikely No (There is no visual indication of a fire or the need for extrication, but it is possible)", Yes (Accidents involving potential injuries and property damage typically require police involvement.)," Sedan, Sedan (Possibly hatchback based on the rear window angles)", No (No visual indication of fire.)," Night, Wet (Appears to be nighttime, and the road surface suggests wet conditions.)"," Yes (The footage is grainy and low resolution, making it difficult to discern details clearly.)"
000115.mp4, 2, Side-swipe/Merge, Unknown, Unknown, No, Possible," Sedan, Compact Car/Hatchback", No," Day, Clear", Yes
000116.mp4, It is not evident that an accident has occured., Cannot determine., Cannot determine., Cannot determine., Cannot determine., Cannot determine.," Potentially sedan, and SUV,", No.," Night, appears to be wet/rainy conditions (reflected lights on the road).", Yes.
000117.mp4, 2, T-bone, Unknown, Unknown, No, Unknown," Hatchback, Sedan", No," Day, clear", Yes
000118.mp4, 2, T-bone (appears the motorcycle collided with the side of the van), Likely yes (given the nature of motorcycle accidents), Likely yes, Likely no, Likely yes," Motorcycle, Van", No," Day, clear weather", Yes
000119.mp4, 2, Side Impact (T-Bone), Cannot determine from the video., Cannot determine from the video., No," Probably Yes, due to the accident.","  Sedan, SUV/Minivan", No," Day, Rainy", Yes
000120.mp4," 0 (Based on the frames, there is no visible accident.)", None, No, No, No, No," Sedan, Van, Light-Colored Car", No, Day/Rainy, Yes
000121.mp4, 1, The bus is going through the intersection, Undetermined, Undetermined, No, Undetermined, Bus, No," Day, clear", Yes
000122.mp4,"  Based on the image, it's difficult to determine, but it appears to be at least 2 vehicles involved, as I see at least two sets of headlights/reflections clustered together.","  It's not possible to definitively determine the accident type from this image. It could be a rear-end, side-impact, or some other type of collision. It is not clear from the image.", Unknown. The image quality is too poor to assess if there are any visible injuries., Unknown. Based on the information provided no ambulance can be verified as needed., Unknown. There is no evidence of fire or smoke in the image.," Likely. Given the nature of traffic accidents, police involvement is often necessary for investigation and documentation.", Unknown. The image is too blurry to determine the types of vehicles involved., No.," Night, Wet/Rainy. The image is dark, and there are reflections on the road, suggesting wet conditions.", Yes.
000123.mp4, 3, Rear end, Cannot determine, Cannot determine, No, Likely," Truck, Sedan", No," Day, clear", Yes
000124.mp4, 0 (There is no accident occurring in the frame.), N/A (No accident is present), No (No accident is present), No (No accident is present), No (No accident is present), No (No accident is present)," The frame shows a bus, a truck, a sedan, and a person riding a orange vehicle.", No," Day, weather appears clear"," Yes (The footage has low resolution, making definitive assessments difficult.)"
000125.mp4,2,T-bone,Possibly yes (based on the nature of the accident),Possibly yes,Possibly no,Yes,Motorcycle and Sedan,No,"Day, possibly overcast",Yes
000126.mp4, 3, T-bone, Yes, Yes, No, Yes," Bus, Scooter and Car", No," Day, Clear", Yes
000127.mp4, 2, T-Bone (based on the position of the vehicles in the frame), Cannot determine with certainty.," Cannot determine with certainty, but likely due to the nature of a T-bone accident."," Cannot determine with certainty, but unlikely unless there is fire or significant vehicle damage requiring extrication.", Very likely due to the accident involving two vehicles., Appears to be two cars (sedan and/or possibly SUV)., No," Night, Weather is unknown.", Yes
000128.mp4, 2," It appears to be a possible side impact or turning collision, but the exact nature is unclear due to the image quality. It's difficult to ascertain if it's a T-bone.", Cannot determine from the image., Cannot determine from the image., Cannot determine from the image., Cannot determine from the image., Appears to be a light delivery truck/van and a sedan or SUV., No.," Night, snowy conditions.", Yes.
000129.mp4, 2, Appears to be a T-bone collision.," Cannot determine from the images, so no."," Cannot determine from the images, so no.", Yes. A firetruck is present at the scene.," Cannot determine from the images, so no."," Sedan, Firetruck.", No.," Day, Clear.", No.
000130.mp4,0 (No visible accident),Not Applicable (No visible accident),no (No visible accident),no (No visible accident),no (No visible accident),no (No visible accident),"SUV, Van, Sedan (These vehicle types are visible, but not involved in an accident)",no,"Day, Clear/Snowy",no
000131.mp4, 2, T-bone," Unknown, based on the footage."," Unknown, based on the footage.", No, Probably yes., Sedan and possible sedan., No," Night, snowy.", Yes
000132.mp4, 2, T-bone, Unclear, Possible, No, Likely," Sedan, Sedan", No," Night, Winter Conditions (snowy)", No
000133.mp4, 3,"  It appears to be a complex intersection collision, with elements that look like a side impact (T-bone) for at least one vehicle. The exact sequence is difficult to determine from a single frame.",  Impossible to determine from the image., Impossible to determine from the image., Impossible to determine from the image.," Very likely, given the severity of the crash.",, No.," Night, possibly wet or icy roads given the lighting and sheen on the pavement."," No, the image quality is acceptable."
000134.mp4,2,T-bone,"Possibly, but not definitively determinable from the image.","Possibly, due to the nature of the T-bone collision.","Unlikely, unless there is a fire or need for vehicle extrication.","Likely, due to the accident and potential for injuries/liability.",Sedans,No,"Daytime, snowy/icy conditions.",No
000135.mp4," I cannot determine the number of vehicles involved in an accident. There are vehicles on the road, but there is no visible accident.",  Cannot determine, Cannot determine,  No., No., No., There are sedans visible in the image., No.," Night, with snowy conditions.", The footage appears to be of low quality.
000136.mp4, 4," Angle/turning collision involving a truck, a motorcycle, and a SUV", yes, yes, no, yes," Truck, SUV, motorcycle.", no," Day, clear weather", yes
000137.mp4,"0 (Based on the single frame, there is no visible accident)",Not Applicable,Unknown,Unknown,No,Unknown,"Sedans, SUVs (based on the vehicles visible)",No,"Day, rainy","No (The footage is not high resolution, but details are visible)"
000138.mp4," 0 (Based on the frames, there is no visible accident occurring.)", N/A (No accident detected), No (No accident detected), No (No accident detected), No (No accident detected), No (No accident detected)," N/A (No accident detected, but based on general view, there are sedans, SUVs, trucks, and vans.)", No (No accident detected)," Day, Clear (Based on visual assessment)"," No (While not high resolution, the footage is clear enough to see general details.)"
000139.mp4, 0 (I don't see any evidence of an accident in these frames), N/A, No, No, No, No," Sedans, SUVs, Van", No," Day, overcast/rainy.", No
000140.mp4, 1 (It is difficult to see but it appears that the sedan hit something in the middle of the road. It could be a person.)," Unknown, possibly pedestrian/object impact, or single car accident."," Unknown, but possible.", Possibly yes., No, Yes, Sedan, No," Night, weather appears clear.", Yes
000141.mp4, 2, T-bone, Possibly (due to the severity of the impact), Likely, Possibly (due to potential fluid spills), Yes (to investigate the accident and manage the scene), SUV and sedan, No," Day, clear", No
000142.mp4, 2, T-bone, Potentially yes (based on the severity of the impact), Likely yes, Potentially yes (due to the impact and possible hazards), Yes (due to the accident and potential injuries), Sedan and Sedan, No," Night, clear", No.
000143.mp4,1,Pedestrian vs. Vehicle,Yes,Likely Yes,No,Likely Yes,"Sedan,",No,"Day, Clear",No
000144.mp4, 2, The accident appears to be a side impact or possibly a T-bone type of collision.," Yes, likely. A person is seen on the ground after the impact."," Yes, likely needed based on the person on the ground."," Unknown, but unlikely given the absence of fire."," Yes, likely needed to investigate the collision.", Two sedans., No., The incident happened at night with clear weather.," Yes, the footage is low resolution and the image quality is poor."
000145.mp4, 2, T-bone, Likely yes. T-bone accidents often result in injuries.," Likely yes, given the potential for injuries in a T-bone accident."," No, no indication of fire or significant debris needing cleanup."," Yes, to investigate the accident, determine fault, and file a report.", Truck and minivan, No," Day, clear", Yes
000146.mp4, 0 (There is no visible accident), N/A, no, no, no, no," White Mini-Van, White small Box Truck, White Sports Car", no," Day, clear", yes
000147.mp4,2,Side Impact/T-Bone,Likely yes,Yes,No,Yes,Hatchback car and a Large Truck.,No,"Day, clear",Yes
000148.mp4, 2, T-bone, Cannot determine, Cannot determine, No, Cannot determine, Sedans, No," Day, clear", No
000149.mp4,,,,,,,,,,
000150.mp4, 2 (based on the image)," T-bone (likely, given the position of the vehicles just before impact)", Unable to determine from the image alone.," Unable to determine from the image alone, but possible given the nature of the collision."," Unable to determine from the image alone, but less likely unless there's a fire or significant fuel spill."," Likely, to investigate the accident and determine fault.", Sedan (appears to be two sedans)., No.," Night, unclear weather (possibly wet or rainy, suggested by the road's reflectivity).", Yes.
000151.mp4, 1 (A silver car is seen).," Unknown, the car appears to be driving away."," Unknown, there is no visible evidence of injury."," Unknown, there is no visible evidence of a need."," No, there is no visible evidence of fire or need for a fire truck."," Unknown, there is no visible evidence of a need.", Car.," No, there is no visible evidence of fire."," Day, clear.", Yes. The resolution is low.
000152.mp4, 1," Unable to determine due to lack of collision evidence, but it appears the white van drove onto the raised walkway in the video.", Unknown, Unknown, No, Unknown, Van, No," Day, clear", Yes
000153.mp4, 2, T-Bone (based on the visible trajectories and position of the vehicles), Unknown (cannot determine from the image), Unknown (cannot determine from the image), No (no visible signs of fire or smoke)," Likely yes (given the nature of the accident and that the footage is from a ""Kent Güvenlik Yönetim Sistemi"" - City Security Management System)", Possibly one sedan and one smaller vehicle. (hard to make out details due to the image quality), No," Night, weather appears clear", Yes
000154.mp4, 1, Single vehicle accident, Undetermined, Unknown, No, Yes, Truck, No," Day, clear", Yes
000155.mp4, 1 (based on the visible vehicles)., Unable to determine from the frame. There is only one car in the frame., Unable to determine from the frame., Unable to determine from the frame., Unable to determine from the frame., Unable to determine from the frame., Appears to be a sedan., No., Day. Weather appears to be wet., Yes.
000156.mp4," 0 (based on the provided frames, there is no apparent accident)", N/A, No, No, No, No," Trucks, vans, and what appears to be a motorcycle, but no indication of their involvement in an accident.", No," Day, clear", Yes
000157.mp4,2,T-bone,yes,yes,no,yes,van and motorcycle,no,"Day, clear",no
000158.mp4, 2, Rear End, Unknown, Unknown, Unlikely, Yes," Sedan, SUV", No," Day, clear", Yes
000159.mp4, 3, Rear-end, Undetermined., Undetermined., No., Likely., Sedans, No.," Night, possibly wet road conditions.", Yes.
000160.mp4, 3, Chain-reaction rear-end collision, Yes, Yes, No, Yes," Sedan, Sedan, Motorcycle", No," Day, rainy", Yes
000161.mp4, 2, T-bone, Likely yes (due to the nature of the impact and the presence of a motorcycle), Likely yes, No, Yes," Motorcycle, Sedan", No," Day, Overcast/Rainy", Yes
000162.mp4, 2, T-Bone, Potentially yes (based on the severity of the impact typically seen in T-bone accidents)., Potentially yes (due to the possibility of injuries)., No (no visible smoke or fire)., Yes (to investigate and manage the accident scene)., Truck and Sedan., No," Day, clear weather."," Yes, the footage is low resolution."
000163.mp4, 2, T-Bone/Angle Collision (appears to be), Potentially yes (based on the severity of impact), Probably yes (due to potential injuries from the crash), Possibly yes (to assess if any hazards or fires may exist), Definitely yes (for accident investigation and documentation), Sedans," No (no visible flames, but some spark/smoke due to friction/collision)"," Night, likely wet or rainy conditions (due to reflections on the road)", Yes (low resolution and quality)
000164.mp4, 2, T-bone, Likely yes, Yes, Unlikely, Yes, Appears to be two sedans, No," Night, likely clear", Yes
000165.mp4, 0, N/A, No, No, No, No," SUV, sedan, van, hatchback", No," Day, clear", Yes
000166.mp4, 2, T-bone, Unknown, Unknown, Unknown, Unknown," Sedan (at least one, potentially two)", No," Night, possibly wet/rainy (reflective surface)", Yes
000167.mp4, 2, T-bone, Yes, Yes, No, Yes," Sedan, Sedan", No," Day, Clear", Yes
000168.mp4, 2, Pedestrian Accident, Likely yes, Likely yes, No, Yes," Sedan, Pedestrian", No," Night, Clear", Yes
000169.mp4,It is difficult to determine if there is any accident. It just shows traffic. Cannot determine the number of vehicles in the incident.,Unknown.,Unknown.,Unknown.,Unknown.,Unknown.,"Tanker truck, possible pickup truck",No.,"Day, clear",Yes
000170.mp4, 2, T-Bone, Unknown, Possible, Yes, Yes, Sedan and Station Wagon, Yes," Night, Unknown Weather", Yes
000171.mp4, 2, T-bone (based on vehicle positions), Unknown (cannot be determined from the frames), Unknown (cannot be determined from the frames), No (no fire is visible), Yes (police logo present on the screen), Van and SUV, No," Night, Wet road", Yes
000172.mp4," 0 (Based on the provided frames, there is no visible accident.)", None (No accident is visible.)," No (Since there's no accident, I assume no injuries.)", No, No, No," Not applicable (Since there's no accident, I can describe some general vehicles in the image. Such as SUV, Truck, Sedan, and Van)", No," Day, clear"," Yes (The footage is low resolution, which makes definitive assessments difficult.)"
000173.mp4,,,,,,,,,,
000174.mp4, 0 (I see no accident), N/A, No, No, No, No, Primarily sedans and SUVs are visible., No," Night, and the weather appears clear.", Yes
000175.mp4,2,"T-Bone (most probable, but cannot confirm fully)",No (cannot confirm with certainty),No (cannot confirm with certainty),No,Yes (Due to the nature of the suspected violation),"Sedan (at least one vehicle), other vehicle type unknown due to resolution",No,"Night, Weather Unknown, presumed clear.",Yes
000176.mp4, 0," None, there is no accident", No, No, No, No," Various: SUVs, sedans, vans, trucks", No," Day, clear", Yes
000177.mp4, 2, T-bone," Possibly, based on the severity of impact."," Possibly, given the impact and potential injuries."," Possibly, due to the nature of the collision."," Definitely, to assess the accident, direct traffic, and determine fault.", SUV and truck or SUV, No evidence of fire in the frames.," Daylight, clear weather."," Yes, the footage is of low resolution."
000178.mp4,0 (There is no accident. Cars crossing the intersection can be seen and the title explains red light violations),N/A,no,no,no,maybe (red light violations),"SUVs, Trucks, Sedans, unknown",no,"Day, clear",yes
000179.mp4," 0 (No accident is visible in these frames. Several cars are visible, but they are moving independently at an intersection.)", N/A (No accident present), No (Based on the absence of an accident), No (Based on the absence of an accident), No (Based on the absence of an accident), No (Based on the absence of an accident), Sedans (or similar sized vehicles) are visible. The exact type of vehicle cannot be determined due to the low resolution., No," Night, weather is unclear.", Yes
000180.mp4, 0, N/A, no, no, no, no," SUVs, sedans, truck, taxi", no," Day, clear", yes
000181.mp4, 2, T-bone, Yes, Yes, Likely, Yes, SUV and Sedan, Yes," Night, clear", Yes
000182.mp4,"0 (Based on the current frames, there's no apparent accident.)",N/A (No accident visible),Unknown (Cannot determine from the image),Unknown (Cannot determine from the image),No (No fire or obvious need visible),"Unknown (Potentially, given the ""Red Light Violations"" title, but not directly observable)","Predominantly sedans, possibly SUVs or vans in the distance.",No,"Night, weather is unclear but appears to be clear.",Yes
000183.mp4, 0 (There is no accident visible in these frames), N/A, Unknown., Unknown., No., Unknown., N/A, No.," Day, clear.", Yes.
000184.mp4, 2, T-bone, Likely yes (based on the severity of the impact), Likely yes, Unknown (depends on fluid leaks or other hazards), Yes (to investigate and create an accident report), Box truck and SUV., No," Daytime, Clear", No
000185.mp4, 2, T-Bone," Yes (likely, given the severity of the crash and debris scattered)", Yes (highly likely)," Yes (possible, but not confirmed based on the visuals, but would assume with the collision damage)"," Yes (likely, to investigate and manage the scene)"," Appears to be a car or smaller vehicle, and a truck of some kind.", No," Night, clear", No (the footage is fairly clear for a night scene)
000186.mp4, 0, None., No., No., No., No., Trucks and sedans are present., No.," Night, possibly wet (road appears shiny).", Yes. The footage is low resolution and grainy.
000187.mp4, 2, Angle Collision,  Likely yes (due to the nature of the impact), Likely yes,"  Potentially yes, for hazard control and vehicle extrication.", Yes (standard for accident investigation and traffic control),  At least two sedans, No (I see no visual evidence of fire)," Night, potentially wet road conditions based on reflections."," Yes (the image is low resolution, making precise assessments difficult)"
