filename,Number of vehicles in accident,Accident Type,Person Injury?,Need for ambulance?,Need for firetruck?,Need for Police?,Types of vehicles involved,Fire?,Weather,Low Res/Bad Footage?
000000.mp4,2,Angle/Side Impact,Yes,Yes (due to visible injuries),No,Yes (standard for traffic accidents with injuries),Motorcycle/Scooter and Motorcycle/Scooter,No,"Day, clear",Yes
000001.mp4, 4,  Multiple rear-end collisions and possibly some glancing blows. It is a chain reaction., Unable to assess from the images.  Potentially yes., Unable to assess from the images. Potentially yes., Unable to assess from the images. Potentially no.,"  Likely yes, due to multiple vehicles involved and potential injuries.", Appears to be mostly sedans and SUVs., No," Day, snowy conditions.","  Yes, the footage is low resolution."
000002.mp4, 4, T-bone," Yes (Likely, based on the severity of the impact)"," Yes (Likely, given the potential for injuries)", Yes (Because there is a fire)," Yes (Standard for accidents, especially with injuries)"," 2 SUVs, 2 Trucks, 1 sedan", Yes," Day, clear", Yes
000003.mp4,2,T-bone,Yes (due to the severity of the impact),Yes,No,Yes,"Sedan, Light Van",No,"Day, clear",No
000004.mp4, 1, Unknown, Unknown, Unknown, Unknown, Unknown, Truck, no," Night, unknown weather", yes
000005.mp4, 2, T-bone. One vehicle appears to be struck on the side.," Difficult to determine from the footage, but given the severity of the impact, it's possible. My best guess is yes."," Likely, due to the nature of the accident. My best guess is yes.", Difficult to say with certainty. There does not appear to be fire. My best guess is no.," Almost certainly, to investigate and file a report. My best guess is yes.", Appears to be an SUV and it is difficult to ascertain the other vehicle., No., Night and the weather appears to be clear., Yes.
000006.mp4, 2," T-bone (likely, given the visible movement and impact)", Cannot determine from the image., Cannot determine from the image., Cannot determine from the image.," Likely, given that it is a car accident."," Based on the images, it's hard to determine but they appear to be sedan type vehicles.", No.," Night, weather is likely clear.", Yes.
000007.mp4,2,T-bone,Cannot determine with certainty from the provided frames.,Cannot determine with certainty from the provided frames.,No,"Cannot determine with certainty from the provided frames, but likely needed due to accident type.","Sedan, undetermined second vehicle",No,"Night, weather appears clear.",Yes
000008.mp4, 0, None, No, No, No, No, Sedan, No," Night, weather unknown but appears clear", Yes
000009.mp4, 2, Appears to be a side-impact collision (T-bone)., Unable to determine from the image., Unable to determine from the image., Unable to determine from the image., Unable to determine from the image., SUV and Pickup Truck., No., Night; weather conditions are not discernible., Yes.
000010.mp4, 3," Based on the video, this appears to be a chain-reaction type accident or a multiple rear-end collision."," Due to the low resolution, I cannot definitively say. I will say likely yes due to the impact severity, but cannot confirm."," Likely yes, given the severity of the collision."," Possibly, but not definite. Primarily needed if there's a fire or extensive vehicle damage requiring extraction, which I cannot confirm in this video."," Yes, to investigate the accident, manage traffic, and file a report.", Multiple sedans and/or SUVs. Hard to discern exact models due to the resolution., No.," Daytime, clear weather.", Yes.
000011.mp4,2,T-Bone,Maybe (Difficult to determine),Maybe (Difficult to determine),No,Yes,"Sedan, Taxi (Looks like a Taxi)",No,"Day, weather unclear",Yes
000012.mp4, 2, T-bone, Unknown, Unknown, Unknown, Unknown," Sedan, undetermined", No," Night, rainy (visibility low)", Yes
000013.mp4, 2, Rear end., Cannot determine from this footage., Cannot determine from this footage., No., Likely., 2 Sedans., No.," Night, weather conditions not determinable.", Yes.
000014.mp4, 3, T-Bone/Side Impact.  It appears one vehicle may have impacted another at a near perpendicular angle.,  Potentially yes. The severity of the impact suggests there is a risk of injury., Likely yes., Possibly yes. Depending on damage to vehicles and the need for extrication.," Yes.  Traffic accidents of this nature generally require police intervention for documentation, investigation, and traffic control."," Sedans are primarily visible, possibly an SUV is present.", No (no signs of fire are visible),"  Daytime, possibly wet conditions (the road appears wet/reflective).", Yes. The footage is low resolution and grainy.
000015.mp4," Based on the single frame provided, it is unclear if there is an accident. I see several vehicles moving in an intersection. Thus, the number cannot be determined.", Not determinable from the image., Not determinable from the image., Not determinable from the image., Not determinable from the image.," Possibly yes, since the footage is from Dubai Police."," Sedan, truck, and possibly other vehicle types.", No.," Night, possibly wet due to reflections on the road.", Low resolution.
000016.mp4, I cannot see an accident., Cannot determine as no accident is visible., Cannot determine., Cannot determine., Cannot determine., Cannot determine.,"  Bus, sedan", No.," Day, clear.", Yes.
000017.mp4," 0 (Based on the provided frames, there is no visible accident.)", N/A (No accident is visible), No (No visible evidence of injury), No (No indication of need), No (No fire or immediate hazard), No (No accident or crime in view)," SUVs, sedans, van, motorcycle/scooter", No," Day, clear", No (The footage appears to be of moderate quality)
000018.mp4, Cannot be determined from this image. The image shows an empty intersection., Cannot be determined from this image., Cannot be determined from this image., Cannot be determined from this image., Cannot be determined from this image., Cannot be determined from this image., Cannot be determined from this image., No," Night, clear", Yes
000019.mp4, 2, Appears to be a T-bone or angle collision.," Potentially yes (based on the nature of the collision), but not definitively visible in the image.", Potentially yes., No., Yes., SUV and Sedan., No.," Night, appears to be wet conditions.", Yes.
000020.mp4, 0, None, No, No, No, No," sedans, SUVs, taxis", No," Day, clear", No
000021.mp4, 0. The video does not show an accident. The video shows cars traveling normally., N/A, No., No., No., No., The video shows multiple cars which include sedans and SUVs., No.," Night, wet."," Yes, the footage is low resolution and blurry."
000022.mp4, 2, T-bone, Undetermined, Possible, No, Yes," Sedan, sports car (or coupe)", No," Day, clear", Yes
000023.mp4, 2 (Based on the movement leading up to a potential collision)," Potential T-bone. The SUV appears to be crossing the path of the truck, suggesting a potential side impact.", Unknown. With the given information it is not possible to know if anyone was injured., Unknown, No. There is no indication of fire or hazardous materials.," Likely. Given the nature of a collision, police presence for investigation and documentation would be standard."," Truck, SUV", No," Night, clear"," Yes, low resolution."
000024.mp4,0,None,No,No,No,No,"Sedans, SUVs, Buses, Trucks",No,"Day, Clear",Yes
000025.mp4, 2, T-bone, Cannot determine from this footage., Cannot determine from this footage., Cannot determine from this footage.," Likely, due to the nature of the accident.", Sedan and SUV, No.," Day, clear weather.", No
000026.mp4, 2," Trailer separation, leading to trailer crash", Yes, Yes, No, Yes, Van and trailer, No," Day, clear", Yes
000027.mp4, 2, Rear end (most probable based on limited view), Unknown, Possibly (presence of emergency vehicles suggests it), Possibly (presence of emergency vehicles suggests it), Yes (presence of emergency vehicles suggests it),, No," Day, Rain", Yes
000028.mp4, 2, T-Bone, Possibly - hard to determine from the images, Possibly - hard to determine from the images, No, Yes," Sedan, Truck", No," Day, Clear", No
000029.mp4, 2, T-bone, Likely yes (based on the severity of the impact)., Likely yes (due to the T-bone collision and potential injuries)., Unknown but unlikely (unless there is a fuel leak or fire risk)., Yes (to investigate the accident and determine fault).," Truck, Sedan", No," Day, Clear weather", Yes
000030.mp4, 2, T-bone, Likely yes (given the severity of the impact), Yes (due to the likely injuries), Possibly (depending on if there is any potential for fire or need for vehicle extrication), Yes (accident of this nature will need a police investigation)," Truck, sedan", No (no flames are visible in the provided frames)," Night, likely wet (based on the road appearance and lighting)", Yes
000031.mp4, 2, The accident type appears to be a rollover.," Based on the video, it's difficult to determine if there are injuries. So, the answer is no."," Unknown; it's impossible to determine from the visual alone. So, the answer is no."," Based on the video, there are no indication to need a fire truck so the answer is no."," Potentially yes, due to the nature of the accident (rollover).", Truck and possibly car.," No, no fire is visible."," Day, and it appears to be clear."," Yes, the footage is low resolution and has timestamping that obstructs visibility."
000032.mp4, Unable to determine from this frame., Unable to determine from this frame., Unable to determine from this frame., Unable to determine from this frame., Unable to determine from this frame., Unable to determine from this frame., Appears to be at least one sedan-type vehicle., No.," Daytime, weather is unclear but appears to be clear.", Yes.
000033.mp4,2,Head-on collision,"Yes, high probability due to the nature of the impact.",Yes,"Possible, depending on the extent of damage and potential hazards (fuel leaks).","Yes, to investigate the accident and manage traffic.",Truck and sedan,No,Day and clear,Yes
000034.mp4," Difficult to determine with certainty from the footage, but it *appears* to be 1.", The vehicle appears to be swerving or out of control rather than involved in a collision., Unknown. No clear evidence., Unknown., No.," Possibly, given the potential for a traffic violation or uncontrolled vehicle.", One SUV visible., No.," Night, and the road appears wet and rainy."," Yes. The footage is low resolution and blurry, making details difficult to discern."
000035.mp4, 2, T-bone, Unknown, Unknown, No, Unknown," Truck, Sedan", No," Day, Snowy", Yes
000036.mp4,2,T-bone,"Yes (Likely, given the severity of the impact to the motorcyclist)",Yes,Unlikely,Yes,"Truck, Motorcycle",No,"Day, clear",Yes
000037.mp4, 1, Rollover/Loss of Control (based on the vehicle's position and lack of another visible vehicle), Unknown (based on visual evidence alone), Unknown (based on visual evidence alone), Unknown (based on visual evidence alone), Unknown (based on visual evidence alone), Appears to be a SUV or van type vehicle., No," Day, Weather appears clear", Yes
000038.mp4, 5, Chain reaction / Pile-up, Likely yes (due to the severity of the collision), Yes," Possibly (to assess safety, but no visible fire)", Yes," Van, Truck, Sedan, Bus", No," Day, clear", Yes
000039.mp4, 2, Possible T-bone or side impact (hard to determine exact angle)," Cannot determine definitively, likely possible", Likely Yes, Unlikely, Likely Yes, Van/Small Truck and Truck, No," Day, Rainy/Wet", Yes
000040.mp4, 1," Single vehicle accident, possibly collision with a fixed object.", Unable to determine from image., Unable to determine from image. Likely needed., Unable to determine from image.," Likely, due to the nature of the accident and potential road obstruction.", Truck or SUV., No.," Daytime, weather is clear.", Yes.
000041.mp4, 1, Single Vehicle Loss of Control, Likely yes. (Due to the severity of the crash.), Likely yes., Potentially yes. (Depends on the presence of fire or need for extraction.), Yes. (Accidents involving potential injury and property damage always require police investigation.), Sedan.," No, but smoke is present."," Night, wet.", Yes.
000042.mp4, 2, T-Bone, Likely yes (due to the severity of the impact), Likely yes," Possibly, but not confirmed from the image", Yes, Sedans, No," Day, clear", Yes
000043.mp4, 2, Side swipe," Unknown, but potentially yes due to the severity of impact."," Possibly yes, depending on injuries sustained."," No, there is no visual indication of fire."," Yes, an accident with this level of damage typically requires a police report.", Car (sedan) and Bus., No," Day, Clear.", Yes
000044.mp4, 2," Appears to be a collision between a truck/pickup and a motorcycle, possibly a side impact or the motorcycle clipping the truck as the truck was merging into traffic.", Likely yes (motorcyclist involved), Likely yes., No, Yes," Truck/Pickup, Motorcycle", No," Day, clear", Yes
000045.mp4,1,Motorcycle vs Person,Yes,Likely yes,No,Likely yes,Motorcycle and Person,No,"Day, Clear",Yes
000046.mp4,2,T-bone,"Yes (likely, based on the impact and the person falling)","Yes (likely, based on the potential for injuries)",No,Yes (due to the accident and potential injuries),"Sedan, Scooter/Motorcycle",No,"Day, Clear",Yes
000047.mp4, 2, T-bone, Unknown, Likely, No, Yes, SUV and Sedan (or similar), No," Day, Clear", No
000048.mp4, 2 (based on the visible interaction and potential damage), T-bone (inferred from the positioning of the vehicles in the intersection),  Cannot determine definitively from the image., Cannot determine definitively from the image.,  Cannot determine definitively from the image., Likely yes (due to the nature of the accident and potential for injuries or property damage)," Pickup truck, Sedans (multiple)", No," Day, Clear", Yes (image quality is not ideal for detailed analysis)
000049.mp4, 1, Pedestrian Struck, Yes, Yes, No, Yes," Sedan, Motorcycle, SUV", No, Day/clear, Yes
000050.mp4,2,T-bone,Possible,Possible,No,Yes,SUV and sedan,No,"Day, overcast",Yes
000051.mp4,2,T-bone,Yes,Yes,No,Yes,"Sedan, Scooter",No,"Day, Clear",Yes
000052.mp4,2,T-bone,Yes (Based on the person lying in the crosswalk after the impact.),"Yes (Likely, given the person is lying in the road after impact, suggesting potential injury.)",No (No visible fire or indication of hazardous materials.),"Yes (Given the accident and potential for injuries, police involvement is likely.)",Sedan and Sedan,No,"Day, unclear weather conditions (likely overcast due to image quality).",Yes
000053.mp4, 2," T-bone (based on the initial images, a vehicle appears to collide with the side of another)"," Likely yes (given the type of accident and vehicles involved, injuries are probable)", Likely yes (due to the potential for injuries), Likely no (no visible signs of fire or hazardous materials), Yes (accident involving large vehicles and likely injuries requires police investigation and traffic control)," Truck, cement mixer", No (no visible fire)," Day, rainy (wet road surface and visible rain)"," Yes (footage is low resolution and blurry, making precise assessment difficult)"
000054.mp4, 2, T-bone, Likely yes (due to the severity of the impact), Yes," Possibly yes (due to severity of the impact and the presence of a firetruck, it may be responding to this)", Yes (for accident investigation)," Sedan, Van", No (no visible flames)," Day, Rainy", Yes
000055.mp4," 0 (There is no accident, the cars are all moving independently. )", N/A, no, no, no, no," Cars (sedans, vans, taxi, bus)", no," Day, appears to be clear", no
000056.mp4, 2, T-bone, Likely yes (Person is seen on ground), Likely yes, No, Yes," Van, Motorcycle", No," Day, clear", Yes
000057.mp4, 2, T-bone, Likely yes (given the severity of a T-bone collision), Likely yes (given the potential for injuries), Unlikely (no visible fire or immediate need for extraction tools based on the video frame)," Yes (accident investigation, traffic control)", Sedan and SUV, No," Night, possible wet conditions (based on the reflective road surface)", Yes (poor image quality makes definitive assessment challenging)
000058.mp4," 0 (Based on these frames, there's no visible collision.)", None (No accident visible), Unknown (No visible injuries in these frames), Unknown (Cannot determine from these frames), No (No fire visible), Unknown (Cannot determine from these frames),"  Sedan, Motorcycle or Scooter (One vehicle appearing to be a sedan is visible. Another vehicle appears to be a motorcycle or scooter)", No," Night, Weather appears to be wet based on how the car lights are reflecting on the road.", Yes (The footage is of low resolution.)
000059.mp4," Undetermined, I'm unable to detect if the vehicles are involved in an accident,", Undetermined. I can't determine if there is a collision.," Unknown. I cannot determine if there is an accident, let alone if there are injuries.", Unknown, Unknown, Unknown," Taxi, sedan (2 possibly SUVs behind)", No," Night, weather appears clear", Yes
000060.mp4, 2, T-bone, Yes (people are exiting one of the vehicles and potentially injured), Yes (given potential injuries), No (no visible fire), Yes (due to the accident and potential injuries)," Sedan, Sedan", No," Night, Wet (roads are wet from the lights)", Yes
000061.mp4, 2, T-bone, Likely Yes, Yes, Yes, Yes, Sedan (Taxi) and Sedan, Yes," Night, possibly wet (based on road reflection)", Yes
000062.mp4, 2, T-bone, Yes, Yes, No, Yes," Sedan, Sedan", No," Night, clear", Yes
000063.mp4, 2, T-bone, Potentially yes (based on the need for emergency services)," Yes (likely, given the police presence and potential for injury)", Possibly (depends on the severity and if there's a fire hazard), Yes (police vehicles are present), SUV/Minivan and sedan/car (difficult to specify with certainty), No (no visible flames)," Night, and the weather appears clear"," Yes (the resolution is not high, making it hard to identify details clearly)"
000064.mp4, 2, T-bone, Unknown (unable to determine from the footage)," Possible (due to the severity of the crash, it's possible)", Unlikely (no visible signs of fire), Likely (due to the nature of the accident), Vans, No," Night, clear", Yes
000065.mp4,2,T-bone,unknown,unknown,no,likely,"van, sedan",no,"day, snowy",no
000066.mp4, 2, T-bone, Unknown.," Possibly, given the accident type."," Possibly, depending on severity and fluid leaks."," Likely, for accident investigation and report.", Appears to be two sedans., No.," Night, snowy conditions.", Yes.
000067.mp4, The video contains no accident., N/A, No, No, No, No," Sedans, possibly SUV", No," Night, clear weather", Yes
000068.mp4, 4, Chain reaction/multiple vehicle collision (likely a rear-end type of accident that escalated)," Likely yes (based on the severity of the crash, it is probable that there were injuries)", Likely yes, Potentially yes (due to the severity of the crash and potential for fuel leaks or other hazards), Yes (required for accident investigation and traffic control)," SUV, sedan, box truck and dump truck", No (no visible signs of fire in the images)," Day, clear", No (footage appears clear and of decent resolution)
000069.mp4, 2, T-bone (Truck struck by train at crossing), Likely yes (Given the severity of the impact), Likely yes, Possibly (Depending on the damage and potential for spilled fuel or hazards), Yes (Accidents of this severity always require police investigation), Truck and Train," No (Visually, there is no fire visible in the frames provided)"," Day, Frosty/Cold (Visible frost on the ground and surrounding areas)", Yes
000070.mp4, 2," Undetermined, but based on the video, the black truck backed into the white car.", Cannot be determined from the images., Cannot be determined from the images., No., Cannot be determined from the images., Truck and sedan., No.," Day, partly cloudy with some snow on the vehicles."," The footage is not great, but has enough clarity to be useable."
000071.mp4," 0 (Based on the single frame, there is no visible accident)", N/A, Unknown, Unknown, No, Unknown," School bus, sedan, motorcycles", No," Day, weather appears clear"," Yes, low resolution."
000072.mp4, Unable to determine if there is an accident, Cannot determine., Cannot determine., Cannot determine., Cannot determine., Cannot determine.," Appears to be sedans, a van, and a possible motorcycle or scooter.", No.," Daytime, weather appears to be clear or possibly overcast/damp (the road looks wet).", Yes.
000073.mp4," 0 (Based on the video provided, there is no accident observed.)", Not Applicable, no, no, no, no," Bus, Sedan, Van.", no," Day, clear.", Yes
000074.mp4, 2, Appears to be a T-bone accident., Unable to determine., Unable to determine., Unable to determine.," Likely, but unable to determine with certainty.", Appears to be a sedan and a motorcycle., No.," Night, weather is unclear but appears to be dry.", Yes.
000075.mp4," Based on the image, it appears there are 2 vehicles involved in the accident."," From this perspective, it is difficult to definitively determine the accident type. It potentially is a side-swipe or a T-bone type, but further information is needed."," Based on the image alone, it's impossible to determine if there are injuries. Unknown", Unknown due to lack of detail. Unknown, No visible evidence of fire or hazmat situation. No," Given that it is an accident between two vehicles, it is safe to assume police should respond. Yes", One vehicle appears to be a Sedan or Hatchback. The other vehicle is difficult to ascertain. Potentially a Sedan., No visible signs of fire. No, It is Daytime and the weather appears Clear.," Yes, the footage is low resolution, making it difficult to discern details."
000076.mp4, 0 (There is no visible accident occurring in the provided frames.), N/A (No accident), N/A (No accident), N/A (No accident), N/A (No accident), N/A (No accident)," Auto rickshaws, motorcycles, cars, bus. (These are present in the scene, but are not in an accident.)", No," Day, likely clear (based on visibility)", Yes
000077.mp4, Undetermined. The image does not reveal an accident or any vehicles., Undetermined. There is no crash visible in the image., Undetermined. The image does not suggest or show injured people., Undetermined. There is no indication of injury., Undetermined. No fire or hazardous situation is visible., Undetermined. No indication of an accident or crime., There are no vehicles involved in an incident in the image., No., Night and undetermined weather., Yes.
000078.mp4, 1," Unknown (based on the single frame, it's impossible to determine if an accident occurred or the type)", Unknown, Unknown, Unknown, Unknown, Car (appears to be a small hatchback), No," Night, unknown weather (appears clear)", Yes
000079.mp4, 2, T-Bone, Likely Yes (based on the activity around the vehicles after the collision), Likely Yes (given the likelihood of injuries), No (no visible fire or smoke), Yes (standard procedure for accidents with potential injuries and traffic disruption)," Bus, Car", No," Day, Clear"," Yes (The image quality is low, making precise assessments difficult)"
000080.mp4, 2," Based on the position of the vehicles, it appears to be a side-impact or broadside accident. The vehicle may have been turning and struck.", Yes. People are on the ground, Yes. Based on the injury., No, Yes. Due to the accident and apparent injuries.," Motor Scooter/Bike, Tricycle Taxi", No," Daytime, clear.", Yes. The footage is of low resolution.
000081.mp4, 2, T-bone, Yes (based on the person falling after the impact), Yes (likely due to visible person injury), No (no visible fire or smoke), Yes (due to the accident and potential injuries)," Motorcycle, Sedan", No," Day, Clear/Sunny", Yes
000082.mp4,2 (possibly more with obscured views),"Angle/Intersection collision (the vehicles are positioned at an angle to each other, suggesting an impact in the intersection)","Unknown (cannot determine from the image, but given the nature of the collision, potential for injury exists)","Unknown (cannot determine from the image, but the potential for injury warrants consideration)",No (no evidence of fire or hazardous materials),Yes (due to the accident and potential for liability/investigation),"Auto rickshaw (Tuk Tuk), Van.",No,"Day, clear","Yes (the resolution is low, making it difficult to discern details)"
000083.mp4, 2, T-bone (based on the visible positioning of the vehicles), Unknown, Unknown, Unknown, Unknown, SUV and Sedan, No," Night, weather unknown", Yes
000084.mp4, I cannot tell from the image., Unknown. The video provides no information on the type of accident., Unknown. There is nothing in the video to indicate if there are any injuries., Unknown. No visible evidence to suggest an ambulance is needed., Unknown. There are no signs of fire or other hazards that would require a fire truck., Unknown. There is no way to tell if police are needed from the video., There appears to be a variety of vehicle types visible in the video:, No. There is no evidence of fire., It appears to be daytime with clear weather.," Yes, the footage appears to be low resolution, which can make it difficult to identify details with certainty."
000085.mp4, 2," T-bone (likely, based on vehicle positions)", Likely yes (based on impact and possible vulnerability of the motorcycle rider), Likely yes, Unlikely, Likely yes, Car (possibly a hatchback or small SUV) and a Motorcycle, No," Day, clear weather"," Yes, low resolution and poor image quality."
000086.mp4," Unknown (at least 2, potentially more).", Unknown (very difficult to determine from this footage)., Unknown, Unknown, Unknown, Unknown," Appears to be at least one truck, possibly other vehicles.", No," Night, weather unknown but visibility is low (possibly foggy or smoky).", Yes
