000087.mp4, 2, T-bone," Possibly yes (based on the severity of the impact, it is plausible there are injuries)", Likely yes (given the nature of the collision), Possibly no (unless there is a fire hazard or vehicle extrication needed), Likely yes (to investigate the accident and manage traffic), Sedan and van, No, Day/Clear, Yes
000088.mp4, 0 (There is no accident in this clip), Not applicable (No accident), No (No accident), No (No accident), No (No accident), No (No accident),"  Not applicable.  The scene shows SUVs, sedans, buses, vans, motorcycles, bicycles.", No," Daytime, appears to be clear", Yes
000089.mp4, 0 (I cannot confirm an accident from the image)., N/A. No accident is confirmed., No. No injury has been confirmed in the image., No. It does not seem that an ambulance is necessary based on image provided., No. It does not seem that a firetruck is necessary based on image provided., No. It does not seem that police are needed.," Sedans, motorcycles, trucks, SUV.", No.," Day, clear", Yes.
000090.mp4, 2, T-bone," Yes (Based on the impact and the general nature of T-bone accidents, it's likely someone was injured)"," Yes (Likely, given the potential for injury)", No (No indication of fire or need for extraction), Yes (Standard procedure for traffic accidents), A small bus/van and a car., No," Day, weather unclear but seems clear.", Yes.
000091.mp4, Potentially 2 (based on context)," Unable to determine without seeing the actual impact. Potentially side swipe or T-bone, based on proximity", Unknown., Unknown., No., Unknown.," Sedan, possible motorcycle", No.," Day, clear.", Yes.
000092.mp4, 1, Single vehicle accident involving collision with an object(Pole), Unknown, Unknown, Unknown, Likely, Box Truck, No," Day, Weather Appears to be Clear.", No
000093.mp4, 2, It appears to be a collision between a motorcycle and a parked vehicle (possibly a small tractor or utility vehicle)," Likely yes, given the nature of the accident."," Likely yes, due to the possibility of injuries.", Likely no," Likely yes, to investigate the accident.", Motorcycle and tractor ( or utility vehicle.), No," Day, rainy", Yes
000094.mp4, 0, None, No, No, No, No," SUVs, trucks, sedans, vans", No," Day, clear", No
000095.mp4,2,"Collision, Truck to Car, resulting in severe damage.",Likely yes (due to the severity of the impact).,Likely yes (due to the severity of the impact).,Possibly yes (due to potential hazards or need for cleanup).,Yes (required for accident investigation and traffic management).,Semi-truck/Trailer and Sedan/Car.,No,"Day, Clear.",Yes.
000096.mp4, 2, The video shows a truck running off the road and then crashing into the rail.," Potentially yes, given the severity of the truck wreck."," Probably yes, given the severity of the truck wreck."," Possibly yes, given the smoke seen."," Yes, for traffic control and accident investigation.", At least one truck.," No, the smoke appears to be from damage to the truck."," Daytime, clear.", Yes.
000097.mp4,2,Likely a broadside or angular impact involving a motorcycle (or scooter) and a van.,Likely yes,Likely yes,Unlikely,Likely yes,Van and motorcycle/scooter,No,"Day, rainy",Yes
000098.mp4, I cannot determine this as the image only shows cars driving in a street., Cannot determine., Cannot determine., Cannot determine., Cannot determine., Cannot determine.," SUVs, sedan, van, and motorcycle.", No.," Night, possibly wet (road appears shiny).", Yes.
000099.mp4, It is impossible to determine how many vehicles are involved in the accident from this frame. I can only see one truck., Impossible to determine from a single image., Cannot be determined., Cannot be determined., Cannot be determined., Cannot be determined., Only a truck is visible., No.," Night, and I cannot determine the weather conditions.", Yes.
000100.mp4," It is difficult to tell from this footage alone since the camera is far away, but there is no indication that there is an accident in this scene.", N/A, N/A, No, No, No," Vans, Sedans, Cars", No," Day, raining", Yes
000101.mp4, 2, T-Bone, Possibly yes (difficult to confirm from the image), Possibly yes (due to the nature of the collision), No (no visible signs of fire)," Yes (given the severity of the collision, police assistance is likely)"," Van, Taxi (likely a van or small bus)", No," Day, weather appears clear", Yes
000102.mp4,"2 (possibly more involved indirectly, but directly visible impact: 2)",Rear-end collision.,"Indeterminate from the video, but possible due to the nature of the collision.","Possibly, given the potential for whiplash or other injuries.","No, fire is not evident.","Likely, to assess fault and document the accident.",A blue hatchback (possibly a Honda) and a dark sedan.,No.,"Daytime, wet/rainy conditions.","Yes, the footage is low resolution, making precise identification and assessment difficult."
000103.mp4,0 (I see no accident in these images.),N/A,no,no,no,no,"Vans, sedans, buses, and small cars",no,"Day, appears to be clear weather.",yes
000104.mp4, 0, N/A, no, no, no, no, minivan/taxi, no, Night and Rainy, yes
000105.mp4, 0, None, No, No, No, No," Various types are visible, including sedans, SUVs, a truck, and a van.", No, Day. Weather appears to be overcast or rainy., Yes
000106.mp4, 2, Angle/T-bone, Yes, Yes (likely), No, Yes," Car, Motorcycle", No," Day, clear", Yes
000107.mp4," 0 (Based on the provided images, there is no visible accident.)", Not applicable (no accident visible), Unknown (no accident visible), No (no accident visible), No (no accident visible), No (no accident visible),"  Visible vehicles include: van, sedan, taxi, bus. (However, none are in an accident in the visible frames).", No," Day, Rainy.", Yes
000108.mp4,2,T-bone,Likely yes (due to severity of impact),Yes,Possibly yes (due to severity of impact),Yes,Sedans,No,"Day, Wet (road conditions)",Yes
000109.mp4, 2, T-Bone (Likely), Undetermined, Undetermined, No, Undetermined," Bus, Sedan", No," Night, Weather Undetermined (Appears wet)", Yes
000110.mp4, 2, T-bone, Likely yes (due to the nature of the accident), Likely yes, Likely no, Yes, Sedans, No," Day, clear", Yes
000111.mp4, 2, T-bone (appears to be based on trajectory), Unknown, Unknown, Unknown," Likely, given the accident type.", sedan and suv., No," Night, wet/rainy", Yes
000112.mp4, 0, N/A, no, no, no, no," sedan and a truck are visible, but not involved in an accident.", no," Day, clear", yes
000113.mp4, 2, T-bone, yes, yes, no, yes," sedan, sedan", no," Night, Rain", yes
000114.mp4," 2 (possibly more, based on the way the video runs)"," Possibly rear-end, sideswipe, or merging collision. It's difficult to determine the exact type due to the low resolution and limited views.", Undetermined. The footage is too blurry to assess.," Possibly, depending on the severity of the impact and potential injuries. Undetermined."," Unlikely, but potentially possible depending on damage/spillage."," Likely, given that there is an accident.", Sedans or hatchback vehicles appear to be involved., No.," Night, possibly wet road conditions (indicated by headlight reflections)."," Yes. The footage is low resolution and blurry, making it difficult to assess details."
000115.mp4, 2," Side collision, possibly sideswipe.", Cannot determine from the image., Cannot determine from the image., Cannot determine from the image., Cannot determine from the image., Appears to be two compact/hatchback style cars., No," Day, clear weather.", Yes
000116.mp4," It's difficult to assess with certainty, but based on the video, the footage is obscured.", Impossible to Determine-footage too grainy, Unknown-footage too grainy, Unknown-footage too grainy, Unknown-footage too grainy, Unknown-footage too grainy," Taxis, SUVS are the types of vehicles I can assess", No," Night, Possibly raining", Yes
000117.mp4,2,T-bone,Unknown,Unknown,Unknown,Unknown,"Sedan, Hatchback",No,"Day, clear",Yes
000118.mp4, 2, T-Bone, Yes, Yes, No, Yes, Car and Motorcycle, No, Day/Clear, Yes
000119.mp4, 2, Side Impact/Angle Collision (appears to be a left turn or crossing the intersection where one car enters at an angle into the other)., It is impossible to determine definitively from the footage.," Based on the limited information, it is difficult to determine if an ambulance is needed.", No," Likely, as it is a motor vehicle accident."," Sedan, Hatchback", No," Day, rainy/wet conditions.", Yes
000120.mp4, 0, Not Applicable, No, No, No, No," SUV, Sedan, Van", No," Day, heavy rain/flooded", Yes
000121.mp4, The video is too short to know if there will be an accident. The video does not show any vehicle collision., Cannot be determined, Cannot be determined, Cannot be determined, Cannot be determined, Cannot be determined," The types of vehicle in the image are a bus, a van, and several sedans", No, Day/Clear, No
000122.mp4," Uncertain. There appears to be a group of headlights clustered together, but it's impossible to definitively say if there are multiple vehicles involved in an accident or just vehicles in close proximity. I suspect more than 1."," Undetermined. The image quality and lack of clarity prevent me from determining the type of accident (t-bone, rear-end, etc.).", Unknown. I cannot determine if there are any injuries based on the image., Unknown., Unknown.," Unknown. The scene suggests a possible accident, making police involvement possible, but not certain."," It appears vehicles are involved, but the exact types (SUV, truck, sedan, etc.) are indistinguishable.", No. There is no visible fire.," Night. The weather appears to be wet/rainy, likely causing the reflections."," Yes. The footage is low resolution and of poor quality, making analysis difficult."
000123.mp4, 3,"  Likely a rear-end collision, although a sideswipe type cannot be ruled out.",  Cannot determine., Cannot determine.,  Cannot determine.,"  Likely, but cannot determine."," Truck, sedan (at least 2)", No.," Day, clear.", Yes
000124.mp4, 0, N/A, no, no, no, no, Single moped, no, Day/clear, yes
000125.mp4,2,T-Bone,"Potentially yes (due to the nature of the accident, injury is possible, but not definitively visible)",Potentially yes (due to potential injury),No (no visible fire or related hazards),Yes (due to the accident involving vehicles),Motorcycle and Sedan (white),No,"Day, unclear, possibly overcast (due to the lighting)","Yes (the image quality is poor, making it difficult to discern details)"
000126.mp4, 2," Appears to be an angle collision, potentially a T-bone style."," Unknown. Based on the video, it's impossible to determine if injuries occurred.", Unknown. Cannot be determined from the video., No.," Likely, due to the nature of the accident.", Bus and scooter, No.," Daytime, weather appears to be clear.", Yes.
000127.mp4, 2, T-bone, Unknown, Unknown, Unknown, Likely," Sedan, and Truck/SUV", No," Night, clear", Yes
000128.mp4, 2," T-bone (most likely, based on vehicle positions)", Unknown (cannot be determined from the image), Unknown (cannot be determined from the image), No (no visible signs of fire), Likely (typical for traffic accidents), Box truck and sedan, No," Night, snowy", Yes
000129.mp4, 2, T-bone," Potentially yes (Given the involvement of a fire truck and severity of the collision, injury is possible)", Likely yes, Yes (Firetruck is involved in the accident), Yes (Due to the accident involving a fire truck and multiple vehicles)," Firetruck, sedan", No (No visible fire)," Day, clear", No
000130.mp4, 0, N/A, no, no, no, no," SUV, van, sedan", no," Day, clear with snow", yes
000131.mp4, 2, T-Bone, Unknown, Unknown, No, Likely, Sedan and Sedan, No," Night, Snowy", Low Res
000132.mp4, 2, T-bone," Unknown, but likely.", Likely, Unlikely, Likely, Sedans (likely), No," Night, likely snowy", Yes
000133.mp4, 3," The image shows a complex intersection collision. It looks like one vehicle may have failed to yield, resulting in at least one t-bone type impact. It's difficult to determine the precise sequence of impacts without additional information.", Impossible to determine from the image., Impossible to determine from the image., Impossible to determine from the image.," Likely, given the severity of the accident and the number of vehicles involved."," Based on the visuals, there appears to be a van/minibus, and two smaller sedan-type vehicles.", No," Night, and the presence of snow on the ground and road indicates potentially icy conditions.", Low resolution making it hard to determine details of accident.
000134.mp4,2,T-bone,Unknown,Unknown,Unknown,Likely,Sedans,No,"Day, Snowy",No
000135.mp4," I cannot determine if any accident occurred from these frames. There are two cars visible near the intersection, but it is unclear if they are involved in an accident.",  Cannot determine, Cannot determine, Cannot determine, Cannot determine, Cannot determine, At least one sedan is visible.  There may be another vehicle in the frame., No," Night, appears to be winter with snow on the ground. The weather conditions are not clear."," Yes, the footage is low resolution."
000136.mp4,"4 (1 SUV, 1 truck, and 2 motorbikes)","Multiple impacts, starting as a side impact then motorcycle impacts","Yes (Likely, given the nature of the accident and the motorcycle involvement)",Yes (Likely due to potential injuries),No (No visible fire or smoke),Yes (Standard for traffic accidents with possible injuries),"SUV, truck, motorcycles",No,"Day, clear","Yes (The video quality is not great, making it difficult to discern details)"
000137.mp4, Unable to determine from this single frame. It is possible there is contact between the silver and dark vehicle in the middle lanes., Potentially a sideswipe or lane change collision., Unknown., Unknown., No., Unknown.," Sedan (at least 2 visible), possibly SUV.", No.," Day, rainy/wet."," No, this is a better quality frame."
000138.mp4," It is impossible to determine the number of vehicles in an accident, there is no accident shown.", No accident is shown.,  Impossible to tell., Impossible to tell., Difficult to tell. There is a fire truck near an intersection., Impossible to tell., There is no accident shown., No.," Day, clear.", Yes.
000139.mp4, 0, N/A, no, no, no, no," Sedans, SUVs, Van", no," Day, likely rainy due to wet roads", Yes
000140.mp4," 1 (Based on the visible image, only one vehicle is present at the scene)", Unknown (Insufficient data to determine the type of accident. There's no clear indication of an accident occurring in the single frame provided)., Unknown (No visible indication of injury)., Unknown (No visible indication)., Unknown (No visible indication)., Unknown (No visible indication)., Sedan (The visible vehicle appears to be a sedan)., No (No visible indication).," Night, Clear (Based on the lighting, it appears to be nighttime and the weather seems clear).", Yes (The footage has a low resolution and is somewhat grainy).
000141.mp4, 2, T-bone," yes, potential injuries seen in accident", yes, no, yes," sedan, sedan", no," Day, clear", no
000142.mp4,2,T-bone,"It is difficult to determine from the footage, but potentially yes.",Possibly yes.,"Potentially yes, there may be smoke from tires.",Yes.,Sedans/Cars,"Possibly no, but there is tire smoke.","Night, clear.",Yes.
000143.mp4, 1, Pedestrian Collision, Yes, Yes, No, Yes, Sedan, No," Day, Clear", No
000144.mp4, 2, Side impact/T-bone, Yes, Yes, No, Yes, Sedans, No," Day, Clear", Yes
000145.mp4,2,T-Bone,Unknown (based on visual information),Unknown (based on visual information),No (no fire visible),Likely (due to the nature of the accident),Truck and Sedan,No,"Day, clear",Yes (low resolution)
000146.mp4, 0, Not applicable (no accident), No, No, No, No," Mazda minivan, Sam's Club Box Truck", No," Day, clear", Yes
000147.mp4, 2," Appears to be a side impact, with one vehicle impacting the side of another (potentially a ""T-bone"")."," Likely yes, given the severity of the impact and the type of vehicles involved."," Yes, highly likely due to potential injuries."," Possibly. Debris and vehicle damage might require their assistance, but there is no fire visible."," Yes, to investigate the accident and manage traffic.", Truck and van., No.," Day, clear.", Yes.
000148.mp4, 2, T-bone, Unknown, Unknown, No, Likely, Sedan and sedan., No, Day/Clear, Yes
000149.mp4,,,,,,,,,,
000150.mp4,2,T-bone,Cannot determine from footage,Cannot determine from footage,Cannot determine from footage,Cannot determine from footage,Sedan and sedan,No,"Night, possibly wet road conditions",Yes
000151.mp4, 1, Pedestrian vs. Vehicle," Yes (Likely, based on the pedestrian being hit.)", Yes (Likely), No (Not indicated)," Yes (Likely, due to the accident)", Sedan, No (Not indicated)," Day, Clear", Yes (Low Resolution)
000152.mp4, Undetermined. (Difficult to ascertain if an accident has occurred based on one frame.), Undetermined., Undetermined., Undetermined., Undetermined., Undetermined., At least one van (appears to be a white van)., No.," Day, appears to be clear.", Yes.
000153.mp4, 2, T-Bone, Unknown, Likely, Unlikely, Yes," Sedan, Sedan", No," Night, Clear", Yes
000154.mp4, 1, Appears to be a rollover.," Unknown, but potentially yes due to the severity of the rollover."," Probably yes, given the potential for injuries."," Possibly, depending on the condition of the vehicle."," Yes, to investigate the cause of the accident and manage the scene.", Truck," No, there is no evidence of fire in the frames."," Day, weather appears clear."," Yes, the footage is relatively low resolution."
000155.mp4, 0, N/A, No, No, No, No, N/A, No," Day, Weather is overcast, roads appear to be wet.", Yes
000156.mp4, I cannot see any accident in this frame., Cannot be determined., Cannot be determined., Cannot be determined., Cannot be determined., Cannot be determined.," I can see a tram or light rail vehicle, several cars/vans, and possibly a motorcycle.", No.," Daytime, clear.", Yes.
000157.mp4, 2, T-Bone (most likely), Likely yes, Yes, Unlikely, Yes, Van and Motorcycle, No," Day, Clear", Yes
000158.mp4, 2, Rear end, Cannot determine from the image., Cannot determine from the image., No, Yes (Based on the logo in the corner and title)," Two sedans. One is red, and the other appears to be black or dark blue.", No," Daytime, clear weather."," Yes, the footage is low resolution."
000159.mp4, 2, Appears to be a rear-end collision., Cannot determine from the image., Cannot determine from the image., No.," Likely, considering it is a traffic accident.", Appears to be two sedans., No., Night; weather looks clear., Yes.
000160.mp4, 2, T-Bone, Yes, Yes, No, Yes," Sedan, Motorcycle", No," Day, Rainy", Yes
000161.mp4, 2, T-bone, Likely yes (based on the motorcycle involvement), Likely yes (due to the motorcycle accident), Unlikely, Yes (standard procedure for accidents)," Motorcycle, Sedan", No," Day, Overcast/Wet", Yes
000162.mp4, 2, T-bone," Unknown, but possible", Likely, Unlikely, Yes," Pickup truck, Sedan", No," Day, Clear", No
000163.mp4, 2," Based on the footage, it appears to be a T-bone accident."," Possibly yes, due to the impact and nature of the collision."," Probably yes, given the potential for injuries."," Possibly yes, given the accident may need cleanup or to avoid other incidents."," Yes, for accident investigation and traffic control.", Sedans., No.," Night, likely wet or rainy due to the road reflection."," Yes, the footage is low resolution and grainy."
000164.mp4, 2, T-bone.," Likely yes, based on the severity of the impact."," Likely yes, due to the potential for injuries."," Possibly, to help clear the area or in case of a fire hazard."," Yes, for accident investigation and traffic control.", Both appear to be sedans.," No, based on the frames."," Night, clear.", Yes.
000165.mp4,0,Not Applicable,Cannot Determine,Cannot Determine,Cannot Determine,Cannot Determine,"SUVs, sedans, a van, taxi cab, small cars",No,"Daytime, clear weather",Yes
000166.mp4, 2, T-bone (likely), Unknown (unable to determine from the footage)," Unknown (likely, given the severity of a T-bone)", No (no visible fire), Yes (traffic incident)," Sedan (most visible), and either another Sedan or a Small SUV", No," Night, wet (street is reflecting light)", Yes (low resolution and blurry due to motion blur)
000167.mp4,2,Appears to be a side impact (T-bone-ish) or collision while merging/changing lanes.,Undetermined.  Impossible to say from the image.,"Undetermined. Possibly, if injuries occurred.",No.,"Yes. Likely, as accidents usually require police reports.",Sedans.,No.,"Day, clear.","Yes, Low Resolution."
000168.mp4, 2,"  Pedestrian strike, with a pedestrian impacted by a vehicle.", Yes, Yes, No, Yes," Sedan (or similar passenger vehicle), Pedestrian", No," Night, weather appears to be clear.", Yes
000169.mp4, 1," Not enough information to determine the accident type. The truck is on a scale, but no accident can be determined", Unknown, Unknown, Unknown, Unknown, Tanker Truck, No," Day, clear", No
000170.mp4, 2, T-Bone/Side Impact, Possibly. Appears someone runs from vehicle.," Likely, given the impact and potential for injuries."," Yes, given the fire."," Yes, to investigate the accident and manage the scene.", Sedan and station wagon or small van.," Yes, vehicle on fire."," Night, clear."," Yes, the footage is low resolution and difficult to discern details."
000171.mp4, 2, T-bone, Cannot determine from the images., Cannot determine from the images., Cannot determine from the images., Cannot determine from the images., SUV and Minibus (van), No," Night, Wet", Yes
000172.mp4," 0 (There is no visual indication of an accident. The video is labeled ""Examples of Red Light Violations"", but doesn't show one.)", Not Applicable, no, no, no, no," SUV, truck, sedan, van.", no," Day, clear", yes
000173.mp4, 0, None, No, No, No, No," Sedans, SUVs, Trucks", No," Day, appears clear", Yes
000174.mp4, 0 (There is no accident present in the frame), N/A, no, no, no, no," Sedans, SUVs, trucks (These are the types of vehicles visible, but no accident is present.)", no," Night, appears to be clear", yes
000175.mp4, 0, N/A, no, no, no, no,  Sedan, no," Night, appears to be clear", yes
000176.mp4, 0, N/A (No accident visible), No, No, No, No," SUVs, trucks, sedans, a van", No," Day, clear", Yes
000177.mp4, Potentially 2. It is hard to tell whether or not the light-colored SUV struck the darker-colored SUV as it travelled through the intersection., Possibly a T-bone., Unknown., Unknown., Unknown., Likely.," SUV, possibly with another SUV.", No.," Day, clear.", Yes.
000178.mp4," I do not see a defined accident in these frames, only traffic moving in an intersection with red light violations listed at the bottom.", N/A, N/A, N/A, N/A, N/A," SUVS, trucks, sedans", no," Day, clear.", yes
000179.mp4," 0 (Based on the frames, there is no visible accident. The vehicles appear to be moving through an intersection.)", N/A, no, no, no, no, Sedans and possibly an SUV (based on headlight height), no," Night, possibly clear", yes
000180.mp4, 0 (There is no evidence of a collision), None, No, No, No, No," SUVs, sedans, a taxi, and other vehicle types are visible in the traffic flow.", No," Day, Clear (Appears to be daylight with clear weather conditions)", Yes (The footage appears to be low resolution)
000181.mp4,2,T-bone,Unknown,Unknown,Unknown,Likely,SUV and sedan,No,"Night, clear",Yes
000182.mp4,0,None Apparent,Cannot Determine,Cannot Determine,Cannot Determine,Cannot Determine,"Sedans, SUVs",No,"Night, Weather Unknown",Yes
000183.mp4, It is impossible to determine from this footage., Unable to determine from these images., Unable to determine from these images., Unable to determine from these images., Unable to determine from these images., Unable to determine from these images.,  SUVs and Sedans are visible., No," Day, clear weather", Yes.
000184.mp4, 2, T-bone, Cannot determine from the image., Cannot determine from the image., Cannot determine from the image., Cannot determine from the image.," SUV, Truck", no," Day, Clear", yes
000185.mp4, 2, T-bone, Yes, Yes, Yes, Yes, Car and Truck, Yes," Night, looks wet", No
000186.mp4," 0 (Based on the images, there is no accident occurring)", Not applicable, No (Not applicable based on no accident), No (Not applicable based on no accident), No (Not applicable based on no accident), No (Not applicable based on no accident),"  Based on the imagery provided, there are Sedans and trucks passing by.", No," Night, likely wet due to reflections on the road.", Yes
000187.mp4,2,Appears to be a side impact or angled collision.,"Based on the severity of the crash, it is likely.","Yes, likely needed.","Potentially, depending on the severity of the impact and any potential hazards.","Yes, for accident investigation and traffic control.","Sedan, Sedan.",No fire visible in the frames.,"Night, Wet Road",No.
000188.mp4,2,Appears to be an intersection collision.,likely yes,likely yes,possibly,likely yes,sedan,no,"night, appears to be clear, but wet roads",yes
000189.mp4, 3," T-bone collision primarily, with likely secondary impacts.", Possibly yes. The severity of the impact suggests potential injuries.," Probably yes, given the force of the collision."," Possibly yes, as a precaution."," Yes, for accident investigation and traffic management.", Vans and sedans, No," Night, clear."," Yes, the resolution is low, making it difficult to ascertain detailed damage or specific circumstances."
000190.mp4, 0, Not applicable. No accident occurred., Not applicable. No accident., No., No., No.," Motorcycle, Station Wagon, Minivan.", No.," Day, clear.", No.
